{"apiBaseHost":"api.github.com","assets":[{"apiDigest":"sha256:b504a3aed177893f7768c5dd480256c227a0f43d73d10339456dc8d316fbccc2","apiUrl":"https://api.github.com/repos/effectstream/binaries/releases/assets/329370522","contentType":"application/x-gzip","createdAt":"2025-12-16T14:20:59Z","downloadUrl":"https://github.com/effectstream/binaries/releases/download/0.3.120/avail-node-macos-arm64-v2.3.0.1.tar.gz","id":329370522,"name":"avail-node-macos-arm64-v2.3.0.1.tar.gz","nodeId":"RA_kwDOQpztJs4Tocua","sha256":"b504a3aed177893f7768c5dd480256c227a0f43d73d10339456dc8d316fbccc2","size":27217068,"state":"uploaded","updatedAt":"2025-12-16T14:21:01Z"},{"apiDigest":"sha256:59b30b3114a34ccbbfb599376e178fb8d9b3366cae2174c2f1da20e75847f823","apiUrl":"https://api.github.com/repos/effectstream/binaries/releases/assets/534345910","contentType":"application/octet-stream","createdAt":"2026-08-28T21:10:09Z","downloadUrl":"https://github.com/effectstream/binaries/releases/download/0.3.120/bls_midnight_2p0","id":534345910,"name":"bls_midnight_2p0","nodeId":"RA_kwDOQpztJs4f2Xi2","sha256":"59b30b3114a34ccbbfb599376e178fb8d9b3366cae2174c2f1da20e75847f823","size":580,"state":"uploaded","updatedAt":"2026-08-28T21:10:09Z"},{"apiDigest":"sha256:bbe04fe3c70d0c138447cb086b4baddc30cb8bb2a004114bc02e6f739516280e","apiUrl":"https://api.github.com/repos/effectstream/binaries/releases/assets/534347933","contentType":"application/octet-stream","createdAt":"2026-08-28T21:12:31Z","downloadUrl":"https://github.com/effectstream/binaries/releases/download/0.3.120/bls_midnight_2p1","id":534347933,"name":"bls_midnight_2p1","nodeId":"RA_kwDOQpztJs4f2YCd","sha256":"bbe04fe3c70d0c138447cb086b4baddc30cb8bb2a004114bc02e6f739516280e","size":772,"state":"uploaded","updatedAt":"2026-08-28T21:12:31Z"},{"apiDigest":"sha256:46b2290933cbed4c378889e4ba971f1a92888331ffb09466acd4ff61a1e2cb42","apiUrl":"https://api.github.com/repos/effectstream/binaries/releases/assets/534348417","contentType":"application/octet-stream","createdAt":"2026-08-28T21:13:05Z","downloadUrl":"https://github.com/effectstream/binaries/releases/download/0.3.120/bls_midnight_2p10","id":534348417,"name":"bls_midnight_2p10","nodeId":"RA_kwDOQpztJs4f2YKB","sha256":"46b2290933cbed4c378889e4ba971f1a92888331ffb09466acd4ff61a1e2cb42","size":196996,"state":"uploaded","updatedAt":"2026-08-28T21:13:05Z"},{"apiDigest":"sha256:9901589d7956ff58be0d85569b2f455b77b58c3758026ffb5bbe4807000b96d1","apiUrl":"https://api.github.com/repos/effectstream/binaries/releases/assets/534348944","contentType":"application/octet-stream","createdAt":"2026-08-28T21:13:34Z","downloadUrl":"https://github.com/effectstream/binaries/releases/download/0.3.120/bls_midnight_2p11","id":534348944,"name":"bls_midnight_2p11","nodeId":"RA_kwDOQpztJs4f2YSQ","sha256":"9901589d7956ff58be0d85569b2f455b77b58c3758026ffb5bbe4807000b96d1","size":393604,"state":"uploaded","updatedAt":"2026-08-28T21:13:34Z"},{"apiDigest":"sha256:ef08eb3fcf62df8f72c515cffa027e681808b530cb016eea104115545ef6d5c8","apiUrl":"https://api.github.com/repos/effectstream/binaries/releases/assets/534349366","contentType":"application/octet-stream","createdAt":"2026-08-28T21:14:03Z","downloadUrl":"https://github.com/effectstream/binaries/releases/download/0.3.120/bls_midnight_2p12","id":534349366,"name":"bls_midnight_2p12","nodeId":"RA_kwDOQpztJs4f2YY2","sha256":"ef08eb3fcf62df8f72c515cffa027e681808b530cb016eea104115545ef6d5c8","size":786820,"state":"uploaded","updatedAt":"2026-08-28T21:14:04Z"},{"apiDigest":"sha256:d3324910969c4cc54143b8045b649e5c3a4bd5fb7b8f85fe1b770f640ce1c803","apiUrl":"https://api.github.com/repos/effectstream/binaries/releases/assets/534349971","contentType":"application/octet-stream","createdAt":"2026-08-28T21:14:37Z","downloadUrl":"https://github.com/effectstream/binaries/releases/download/0.3.120/bls_midnight_2p13","id":534349971,"name":"bls_midnight_2p13","nodeId":"RA_kwDOQpztJs4f2YiT","sha256":"d3324910969c4cc54143b8045b649e5c3a4bd5fb7b8f85fe1b770f640ce1c803","size":1573252,"state":"uploaded","updatedAt":"2026-08-28T21:14:37Z"},{"apiDigest":"sha256:fc253016885ec830e97808c9ec920bb5cab5c21af590380a6cb5eb0538e2b244","apiUrl":"https://api.github.com/repos/effectstream/binaries/releases/assets/534350623","contentType":"application/octet-stream","createdAt":"2026-08-28T21:15:07Z","downloadUrl":"https://github.com/effectstream/binaries/releases/download/0.3.120/bls_midnight_2p14","id":534350623,"name":"bls_midnight_2p14","nodeId":"RA_kwDOQpztJs4f2Ysf","sha256":"fc253016885ec830e97808c9ec920bb5cab5c21af590380a6cb5eb0538e2b244","size":3146116,"state":"uploaded","updatedAt":"2026-08-28T21:15:07Z"},{"apiDigest":"sha256:724c7c3d779148bb113c7ee9c034b2f27db16e6bdf315fde90105a9bad00b1de","apiUrl":"https://api.github.com/repos/effectstream/binaries/releases/assets/534352492","contentType":"application/octet-stream","createdAt":"2026-08-28T21:16:38Z","downloadUrl":"https://github.com/effectstream/binaries/releases/download/0.3.120/bls_midnight_2p15","id":534352492,"name":"bls_midnight_2p15","nodeId":"RA_kwDOQpztJs4f2ZJs","sha256":"724c7c3d779148bb113c7ee9c034b2f27db16e6bdf315fde90105a9bad00b1de","size":6291844,"state":"uploaded","updatedAt":"2026-08-28T21:16:38Z"},{"apiDigest":"sha256:09c877216d6589b370263e18af40a030a901b41a7a7c37ef58c9901db41f05c6","apiUrl":"https://api.github.com/repos/effectstream/binaries/releases/assets/534352977","contentType":"application/octet-stream","createdAt":"2026-08-28T21:17:11Z","downloadUrl":"https://github.com/effectstream/binaries/releases/download/0.3.120/bls_midnight_2p16","id":534352977,"name":"bls_midnight_2p16","nodeId":"RA_kwDOQpztJs4f2ZRR","sha256":"09c877216d6589b370263e18af40a030a901b41a7a7c37ef58c9901db41f05c6","size":12583300,"state":"uploaded","updatedAt":"2026-08-28T21:17:13Z"},{"apiDigest":"sha256:4a9ef6c7c0619aab74eede44b13e753e3ba54508a02dd3b7106a949aabb73b74","apiUrl":"https://api.github.com/repos/effectstream/binaries/releases/assets/534353376","contentType":"application/octet-stream","createdAt":"2026-08-28T21:17:41Z","downloadUrl":"https://github.com/effectstream/binaries/releases/download/0.3.120/bls_midnight_2p17","id":534353376,"name":"bls_midnight_2p17","nodeId":"RA_kwDOQpztJs4f2ZXg","sha256":"4a9ef6c7c0619aab74eede44b13e753e3ba54508a02dd3b7106a949aabb73b74","size":25166212,"state":"uploaded","updatedAt":"2026-08-28T21:17:43Z"},{"apiDigest":"sha256:e8436dc5d8b598f169c127c745135d889744007e6d384ff126df8d1332522f86","apiUrl":"https://api.github.com/repos/effectstream/binaries/releases/assets/534353931","contentType":"application/octet-stream","createdAt":"2026-08-28T21:18:14Z","downloadUrl":"https://github.com/effectstream/binaries/releases/download/0.3.120/bls_midnight_2p18","id":534353931,"name":"bls_midnight_2p18","nodeId":"RA_kwDOQpztJs4f2ZgL","sha256":"e8436dc5d8b598f169c127c745135d889744007e6d384ff126df8d1332522f86","size":50332036,"state":"uploaded","updatedAt":"2026-08-28T21:18:17Z"},{"apiDigest":"sha256:8e8dc15c4362f05c912f1e770559a3945db3e58a374def416ed5d3e65ad5b10e","apiUrl":"https://api.github.com/repos/effectstream/binaries/releases/assets/534354357","contentType":"application/octet-stream","createdAt":"2026-08-28T21:18:47Z","downloadUrl":"https://github.com/effectstream/binaries/releases/download/0.3.120/bls_midnight_2p19","id":534354357,"name":"bls_midnight_2p19","nodeId":"RA_kwDOQpztJs4f2Zm1","sha256":"8e8dc15c4362f05c912f1e770559a3945db3e58a374def416ed5d3e65ad5b10e","size":100663684,"state":"uploaded","updatedAt":"2026-08-28T21:18:53Z"},{"apiDigest":"sha256:80e15568fa1a0117db893239be7fa5e34a6bcc3a8c3bfa7709534b9cb88eb6c1","apiUrl":"https://api.github.com/repos/effectstream/binaries/releases/assets/534354993","contentType":"application/octet-stream","createdAt":"2026-08-28T21:19:27Z","downloadUrl":"https://github.com/effectstream/binaries/releases/download/0.3.120/bls_midnight_2p2","id":534354993,"name":"bls_midnight_2p2","nodeId":"RA_kwDOQpztJs4f2Zwx","sha256":"80e15568fa1a0117db893239be7fa5e34a6bcc3a8c3bfa7709534b9cb88eb6c1","size":1156,"state":"uploaded","updatedAt":"2026-08-28T21:19:28Z"},{"apiDigest":"sha256:4be827a6472193df80d8f08b4b25a85baef436fdd1965d89b6af89f4ec4e99e2","apiUrl":"https://api.github.com/repos/effectstream/binaries/releases/assets/534355536","contentType":"application/octet-stream","createdAt":"2026-08-28T21:19:55Z","downloadUrl":"https://github.com/effectstream/binaries/releases/download/0.3.120/bls_midnight_2p3","id":534355536,"name":"bls_midnight_2p3","nodeId":"RA_kwDOQpztJs4f2Z5Q","sha256":"4be827a6472193df80d8f08b4b25a85baef436fdd1965d89b6af89f4ec4e99e2","size":1924,"state":"uploaded","updatedAt":"2026-08-28T21:19:55Z"},{"apiDigest":"sha256:232f401fad10c7ddf8828d2aa4c85c6506c5da09795998cecaeb9f75fc8f6ada","apiUrl":"https://api.github.com/repos/effectstream/binaries/releases/assets/534355926","contentType":"application/octet-stream","createdAt":"2026-08-28T21:20:22Z","downloadUrl":"https://github.com/effectstream/binaries/releases/download/0.3.120/bls_midnight_2p4","id":534355926,"name":"bls_midnight_2p4","nodeId":"RA_kwDOQpztJs4f2Z_W","sha256":"232f401fad10c7ddf8828d2aa4c85c6506c5da09795998cecaeb9f75fc8f6ada","size":3460,"state":"uploaded","updatedAt":"2026-08-28T21:20:22Z"},{"apiDigest":"sha256:0a1c9229f315fc1868ff25f668fb83aec4d09f4f23a706b5197c692c619d72c6","apiUrl":"https://api.github.com/repos/effectstream/binaries/releases/assets/534356293","contentType":"application/octet-stream","createdAt":"2026-08-28T21:20:50Z","downloadUrl":"https://github.com/effectstream/binaries/releases/download/0.3.120/bls_midnight_2p5","id":534356293,"name":"bls_midnight_2p5","nodeId":"RA_kwDOQpztJs4f2aFF","sha256":"0a1c9229f315fc1868ff25f668fb83aec4d09f4f23a706b5197c692c619d72c6","size":6532,"state":"uploaded","updatedAt":"2026-08-28T21:20:50Z"},{"apiDigest":"sha256:cf2ad6be7d0fedf5bec2aaa35f6be4aca33053d74268fdf5aa54fcb2891ea6df","apiUrl":"https://api.github.com/repos/effectstream/binaries/releases/assets/534356804","contentType":"application/octet-stream","createdAt":"2026-08-28T21:2